{
  "workflow_id": "cellranger-multi-finish",
  "manifest_path": "finish/cellranger-multi-finish/manifest.json",
  "version": "1",
  "updated_at": "2026-04-16",
  "notes": "Autogenerated contiguous partition. Edit pipeline_stage_label / inputs / outputs for paper-facing semantics.",
  "tasks": [
    {
      "task_id": "stage_01",
      "pipeline_stage_label": "Automated stage 1 (4 finish steps)",
      "order": 1,
      "step_ids": [
        "follow_pedantic_cell_ranger_naming_scheme",
        "create_cellranger_multi_config_csv",
        "cellranger_multi_run",
        "cellranger_multi_files_summaries"
      ],
      "metadata": {
        "autogenerated": true,
        "summary": "Contiguous partition from finish manifest order; refine labels and IO as needed."
      },
      "inputs": [
        {
          "role": "workflow_entry",
          "description": "See finish manifest input_hints"
        }
      ],
      "outputs": [
        {
          "role": "checkpoint_last_step",
          "path_glob": "results/finish/cellranger_multi_files_summaries.done",
          "derived_from_step_ids": [
            "cellranger_multi_files_summaries"
          ]
        }
      ],
      "step_snapshots": [
        {
          "id": "follow_pedantic_cell_ranger_naming_scheme",
          "name": "follow pedantic cell ranger naming scheme",
          "outputs": [
            "results/finish/follow_pedantic_cell_ranger_naming_scheme.done"
          ],
          "depends_on": []
        },
        {
          "id": "create_cellranger_multi_config_csv",
          "name": "create cellranger multi config csv",
          "outputs": [
            "results/finish/create_cellranger_multi_config_csv.done"
          ],
          "depends_on": [
            "follow_pedantic_cell_ranger_naming_scheme"
          ]
        },
        {
          "id": "cellranger_multi_run",
          "name": "cellranger multi run",
          "outputs": [
            "results/finish/cellranger_multi_run.done"
          ],
          "depends_on": [
            "create_cellranger_multi_config_csv"
          ]
        },
        {
          "id": "cellranger_multi_files_summaries",
          "name": "cellranger multi files summaries",
          "outputs": [
            "results/finish/cellranger_multi_files_summaries.done"
          ],
          "depends_on": [
            "cellranger_multi_run"
          ]
        }
      ]
    },
    {
      "task_id": "stage_02",
      "pipeline_stage_label": "Automated stage 2 (4 finish steps)",
      "order": 2,
      "step_ids": [
        "cellranger_multi_files_multiplexing_global",
        "cellranger_multi_files_multiplexing_per_sample",
        "cellranger_multi_files_multiplexing_antibody_global",
        "cellranger_multi_files_multiplexing_crispr_global"
      ],
      "metadata": {
        "autogenerated": true,
        "summary": "Contiguous partition from finish manifest order; refine labels and IO as needed."
      },
      "inputs": [
        {
          "role": "upstream",
          "derived_from_step_ids": [
            "cellranger_multi_files_multiplexing_global"
          ]
        }
      ],
      "outputs": [
        {
          "role": "checkpoint_last_step",
          "path_glob": "results/finish/cellranger_multi_files_multiplexing_crispr_global.done",
          "derived_from_step_ids": [
            "cellranger_multi_files_multiplexing_crispr_global"
          ]
        }
      ],
      "step_snapshots": [
        {
          "id": "cellranger_multi_files_multiplexing_global",
          "name": "cellranger multi files multiplexing global",
          "outputs": [
            "results/finish/cellranger_multi_files_multiplexing_global.done"
          ],
          "depends_on": [
            "cellranger_multi_files_summaries"
          ]
        },
        {
          "id": "cellranger_multi_files_multiplexing_per_sample",
          "name": "cellranger multi files multiplexing per sample",
          "outputs": [
            "results/finish/cellranger_multi_files_multiplexing_per_sample.done"
          ],
          "depends_on": [
            "cellranger_multi_files_multiplexing_global"
          ]
        },
        {
          "id": "cellranger_multi_files_multiplexing_antibody_global",
          "name": "cellranger multi files multiplexing antibody global",
          "outputs": [
            "results/finish/cellranger_multi_files_multiplexing_antibody_global.done"
          ],
          "depends_on": [
            "cellranger_multi_files_multiplexing_per_sample"
          ]
        },
        {
          "id": "cellranger_multi_files_multiplexing_crispr_global",
          "name": "cellranger multi files multiplexing crispr global",
          "outputs": [
            "results/finish/cellranger_multi_files_multiplexing_crispr_global.done"
          ],
          "depends_on": [
            "cellranger_multi_files_multiplexing_antibody_global"
          ]
        }
      ]
    },
    {
      "task_id": "stage_03",
      "pipeline_stage_label": "Automated stage 3 (3 finish steps)",
      "order": 3,
      "step_ids": [
        "cellranger_multi_files_gene_expression_global",
        "cellranger_multi_files_gene_expression_per_sample",
        "cellranger_multi_files_vdj_reference"
      ],
      "metadata": {
        "autogenerated": true,
        "summary": "Contiguous partition from finish manifest order; refine labels and IO as needed."
      },
      "inputs": [
        {
          "role": "upstream",
          "derived_from_step_ids": [
            "cellranger_multi_files_gene_expression_global"
          ]
        }
      ],
      "outputs": [
        {
          "role": "checkpoint_last_step",
          "path_glob": "results/finish/cellranger_multi_files_vdj_reference.done",
          "derived_from_step_ids": [
            "cellranger_multi_files_vdj_reference"
          ]
        }
      ],
      "step_snapshots": [
        {
          "id": "cellranger_multi_files_gene_expression_global",
          "name": "cellranger multi files gene expression global",
          "outputs": [
            "results/finish/cellranger_multi_files_gene_expression_global.done"
          ],
          "depends_on": [
            "cellranger_multi_files_multiplexing_crispr_global"
          ]
        },
        {
          "id": "cellranger_multi_files_gene_expression_per_sample",
          "name": "cellranger multi files gene expression per sample",
          "outputs": [
            "results/finish/cellranger_multi_files_gene_expression_per_sample.done"
          ],
          "depends_on": [
            "cellranger_multi_files_gene_expression_global"
          ]
        },
        {
          "id": "cellranger_multi_files_vdj_reference",
          "name": "cellranger multi files vdj reference",
          "outputs": [
            "results/finish/cellranger_multi_files_vdj_reference.done"
          ],
          "depends_on": [
            "cellranger_multi_files_gene_expression_per_sample"
          ]
        }
      ]
    },
    {
      "task_id": "stage_04",
      "pipeline_stage_label": "Automated stage 4 (3 finish steps)",
      "order": 4,
      "step_ids": [
        "cellranger_multi_files_vdj_global",
        "cellranger_multi_files_vdj_per_sample",
        "all"
      ],
      "metadata": {
        "autogenerated": true,
        "summary": "Contiguous partition from finish manifest order; refine labels and IO as needed."
      },
      "inputs": [
        {
          "role": "upstream",
          "derived_from_step_ids": [
            "cellranger_multi_files_vdj_global"
          ]
        }
      ],
      "outputs": [
        {
          "role": "checkpoint_last_step",
          "path_glob": "results/finish/all.done",
          "derived_from_step_ids": [
            "all"
          ]
        }
      ],
      "step_snapshots": [
        {
          "id": "cellranger_multi_files_vdj_global",
          "name": "cellranger multi files vdj global",
          "outputs": [
            "results/finish/cellranger_multi_files_vdj_global.done"
          ],
          "depends_on": [
            "cellranger_multi_files_vdj_reference"
          ]
        },
        {
          "id": "cellranger_multi_files_vdj_per_sample",
          "name": "cellranger multi files vdj per sample",
          "outputs": [
            "results/finish/cellranger_multi_files_vdj_per_sample.done"
          ],
          "depends_on": [
            "cellranger_multi_files_vdj_global"
          ]
        },
        {
          "id": "all",
          "name": "all",
          "outputs": [
            "results/finish/all.done"
          ],
          "depends_on": [
            "cellranger_multi_files_vdj_per_sample"
          ]
        }
      ]
    }
  ]
}
