{
  "workflow_id": "lwang-genomics-ngs_pipeline_sn-chip_seq-finish",
  "manifest_path": "finish/lwang-genomics-ngs_pipeline_sn-chip_seq-finish/manifest.json",
  "version": "1",
  "updated_at": "2026-04-16",
  "notes": "Autogenerated contiguous partition. Edit pipeline_stage_label / inputs / outputs for paper-facing semantics.",
  "tasks": [
    {
      "task_id": "stage_01",
      "pipeline_stage_label": "Automated stage 1 (4 finish steps)",
      "order": 1,
      "step_ids": [
        "fastqc_raw",
        "trim",
        "align",
        "filter_sort_index"
      ],
      "metadata": {
        "autogenerated": true,
        "summary": "Contiguous partition from finish manifest order; refine labels and IO as needed."
      },
      "inputs": [
        {
          "role": "workflow_entry",
          "description": "See finish manifest input_hints"
        }
      ],
      "outputs": [
        {
          "role": "checkpoint_last_step",
          "path_glob": "results/finish/filter_sort_index.done",
          "derived_from_step_ids": [
            "filter_sort_index"
          ]
        }
      ],
      "step_snapshots": [
        {
          "id": "fastqc_raw",
          "name": "fastqc raw",
          "outputs": [
            "results/finish/fastqc_raw.done"
          ],
          "depends_on": []
        },
        {
          "id": "trim",
          "name": "trim",
          "outputs": [
            "results/finish/trim.done"
          ],
          "depends_on": [
            "fastqc_raw"
          ]
        },
        {
          "id": "align",
          "name": "align",
          "outputs": [
            "results/finish/align.done"
          ],
          "depends_on": [
            "trim"
          ]
        },
        {
          "id": "filter_sort_index",
          "name": "filter sort index",
          "outputs": [
            "results/finish/filter_sort_index.done"
          ],
          "depends_on": [
            "align"
          ]
        }
      ]
    },
    {
      "task_id": "stage_02",
      "pipeline_stage_label": "Automated stage 2 (4 finish steps)",
      "order": 2,
      "step_ids": [
        "bam_coverage",
        "call_peaks",
        "multiqc",
        "all"
      ],
      "metadata": {
        "autogenerated": true,
        "summary": "Contiguous partition from finish manifest order; refine labels and IO as needed."
      },
      "inputs": [
        {
          "role": "upstream",
          "derived_from_step_ids": [
            "bam_coverage"
          ]
        }
      ],
      "outputs": [
        {
          "role": "checkpoint_last_step",
          "path_glob": "results/finish/all.done",
          "derived_from_step_ids": [
            "all"
          ]
        }
      ],
      "step_snapshots": [
        {
          "id": "bam_coverage",
          "name": "bam coverage",
          "outputs": [
            "results/finish/bam_coverage.done"
          ],
          "depends_on": [
            "filter_sort_index"
          ]
        },
        {
          "id": "call_peaks",
          "name": "call peaks",
          "outputs": [
            "results/finish/call_peaks.done"
          ],
          "depends_on": [
            "bam_coverage"
          ]
        },
        {
          "id": "multiqc",
          "name": "multiqc",
          "outputs": [
            "results/finish/multiqc.done"
          ],
          "depends_on": [
            "call_peaks"
          ]
        },
        {
          "id": "all",
          "name": "all",
          "outputs": [
            "results/finish/all.done"
          ],
          "depends_on": [
            "multiqc"
          ]
        }
      ]
    }
  ]
}
