{
  "workflow_id": "epigen-dea_seurat-finish",
  "manifest_path": "finish/epigen-dea_seurat-finish/manifest.json",
  "version": "1",
  "updated_at": "2026-04-16",
  "notes": "Autogenerated contiguous partition. Edit pipeline_stage_label / inputs / outputs for paper-facing semantics.",
  "tasks": [
    {
      "task_id": "stage_01",
      "pipeline_stage_label": "Automated stage 1 (4 finish steps)",
      "order": 1,
      "step_ids": [
        "dea",
        "aggregate",
        "feature_lists",
        "volcanos"
      ],
      "metadata": {
        "autogenerated": true,
        "summary": "Contiguous partition from finish manifest order; refine labels and IO as needed."
      },
      "inputs": [
        {
          "role": "workflow_entry",
          "description": "See finish manifest input_hints"
        }
      ],
      "outputs": [
        {
          "role": "checkpoint_last_step",
          "path_glob": "results/finish/volcanos.done",
          "derived_from_step_ids": [
            "volcanos"
          ]
        }
      ],
      "step_snapshots": [
        {
          "id": "dea",
          "name": "dea",
          "outputs": [
            "results/finish/dea.done"
          ],
          "depends_on": []
        },
        {
          "id": "aggregate",
          "name": "aggregate",
          "outputs": [
            "results/finish/aggregate.done"
          ],
          "depends_on": [
            "dea"
          ]
        },
        {
          "id": "feature_lists",
          "name": "feature lists",
          "outputs": [
            "results/finish/feature_lists.done"
          ],
          "depends_on": [
            "aggregate"
          ]
        },
        {
          "id": "volcanos",
          "name": "volcanos",
          "outputs": [
            "results/finish/volcanos.done"
          ],
          "depends_on": [
            "feature_lists"
          ]
        }
      ]
    },
    {
      "task_id": "stage_02",
      "pipeline_stage_label": "Automated stage 2 (3 finish steps)",
      "order": 2,
      "step_ids": [
        "heatmap",
        "env_export",
        "config_export"
      ],
      "metadata": {
        "autogenerated": true,
        "summary": "Contiguous partition from finish manifest order; refine labels and IO as needed."
      },
      "inputs": [
        {
          "role": "upstream",
          "derived_from_step_ids": [
            "heatmap"
          ]
        }
      ],
      "outputs": [
        {
          "role": "checkpoint_last_step",
          "path_glob": "results/finish/config_export.done",
          "derived_from_step_ids": [
            "config_export"
          ]
        }
      ],
      "step_snapshots": [
        {
          "id": "heatmap",
          "name": "heatmap",
          "outputs": [
            "results/finish/heatmap.done"
          ],
          "depends_on": [
            "volcanos"
          ]
        },
        {
          "id": "env_export",
          "name": "env export",
          "outputs": [
            "results/finish/env_export.done"
          ],
          "depends_on": [
            "heatmap"
          ]
        },
        {
          "id": "config_export",
          "name": "config export",
          "outputs": [
            "results/finish/config_export.done"
          ],
          "depends_on": [
            "env_export"
          ]
        }
      ]
    },
    {
      "task_id": "stage_03",
      "pipeline_stage_label": "Automated stage 3 (3 finish steps)",
      "order": 3,
      "step_ids": [
        "annot_export",
        "feature_list_export",
        "all"
      ],
      "metadata": {
        "autogenerated": true,
        "summary": "Contiguous partition from finish manifest order; refine labels and IO as needed."
      },
      "inputs": [
        {
          "role": "upstream",
          "derived_from_step_ids": [
            "annot_export"
          ]
        }
      ],
      "outputs": [
        {
          "role": "checkpoint_last_step",
          "path_glob": "results/finish/all.done",
          "derived_from_step_ids": [
            "all"
          ]
        }
      ],
      "step_snapshots": [
        {
          "id": "annot_export",
          "name": "annot export",
          "outputs": [
            "results/finish/annot_export.done"
          ],
          "depends_on": [
            "config_export"
          ]
        },
        {
          "id": "feature_list_export",
          "name": "feature list export",
          "outputs": [
            "results/finish/feature_list_export.done"
          ],
          "depends_on": [
            "annot_export"
          ]
        },
        {
          "id": "all",
          "name": "all",
          "outputs": [
            "results/finish/all.done"
          ],
          "depends_on": [
            "feature_list_export"
          ]
        }
      ]
    }
  ]
}
