{
  "workflow_id": "rna-seq-star-deseq2-finish",
  "manifest_path": "finish/rna-seq-star-deseq2-finish/manifest.json",
  "version": "1",
  "updated_at": "2026-04-16",
  "notes": "Autogenerated contiguous partition. Edit pipeline_stage_label / inputs / outputs for paper-facing semantics.",
  "tasks": [
    {
      "task_id": "stage_01",
      "pipeline_stage_label": "Automated stage 1 (4 finish steps)",
      "order": 1,
      "step_ids": [
        "trimming",
        "alignment",
        "rseqc_qc",
        "multiqc_report"
      ],
      "metadata": {
        "autogenerated": true,
        "summary": "Contiguous partition from finish manifest order; refine labels and IO as needed."
      },
      "inputs": [
        {
          "role": "workflow_entry",
          "description": "See finish manifest input_hints"
        }
      ],
      "outputs": [
        {
          "role": "checkpoint_last_step",
          "path_glob": "results/qc/multiqc_report.html",
          "derived_from_step_ids": [
            "multiqc_report"
          ]
        }
      ],
      "step_snapshots": [
        {
          "id": "trimming",
          "name": "Trimming reads",
          "outputs": [
            "results/trimmed/A1/A1-1_R1.fastq.gz",
            "results/trimmed/A1/A1-1_R2.fastq.gz",
            "results/trimmed/B1/B1-1_R1.fastq.gz",
            "results/trimmed/B1/B1-1_R2.fastq.gz",
            "results/trimmed/A2/A2-1_R1.fastq.gz",
            "results/trimmed/A2/A2-1_R2.fastq.gz",
            "results/trimmed/B2/B2-1_R1.fastq.gz",
            "results/trimmed/B2/B2-1_R2.fastq.gz"
          ],
          "depends_on": []
        },
        {
          "id": "alignment",
          "name": "Align reads with STAR",
          "outputs": [
            "results/star/A1-1/Aligned.sortedByCoord.out.bam",
            "results/star/A1-1/ReadsPerGene.out.tab",
            "results/star/B1-1/Aligned.sortedByCoord.out.bam",
            "results/star/B1-1/ReadsPerGene.out.tab",
            "results/star/A2-1/Aligned.sortedByCoord.out.bam",
            "results/star/A2-1/ReadsPerGene.out.tab",
            "results/star/B2-1/Aligned.sortedByCoord.out.bam",
            "results/star/B2-1/ReadsPerGene.out.tab"
          ],
          "depends_on": [
            "trimming"
          ]
        },
        {
          "id": "rseqc_qc",
          "name": "Run RSeQC quality control",
          "outputs": [
            "results/qc/rseqc/A1-1.infer_experiment.txt",
            "results/qc/rseqc/B1-1.infer_experiment.txt",
            "results/qc/rseqc/A2-1.infer_experiment.txt",
            "results/qc/rseqc/B2-1.infer_experiment.txt"
          ],
          "depends_on": [
            "alignment"
          ]
        },
        {
          "id": "multiqc_report",
          "name": "Aggregate QC with MultiQC",
          "outputs": [
            "results/qc/multiqc_report.html"
          ],
          "depends_on": [
            "rseqc_qc"
          ]
        }
      ]
    },
    {
      "task_id": "stage_02",
      "pipeline_stage_label": "Automated stage 2 (3 finish steps)",
      "order": 2,
      "step_ids": [
        "count_matrix",
        "differential_expression",
        "pca_plot"
      ],
      "metadata": {
        "autogenerated": true,
        "summary": "Contiguous partition from finish manifest order; refine labels and IO as needed."
      },
      "inputs": [
        {
          "role": "upstream",
          "derived_from_step_ids": [
            "count_matrix"
          ]
        }
      ],
      "outputs": [
        {
          "role": "checkpoint_last_step",
          "path_glob": "results/pca.condition.svg",
          "derived_from_step_ids": [
            "pca_plot"
          ]
        }
      ],
      "step_snapshots": [
        {
          "id": "count_matrix",
          "name": "Build count matrix",
          "outputs": [
            "results/counts/all.tsv",
            "results/counts/all.symbol.tsv"
          ],
          "depends_on": [
            "alignment"
          ]
        },
        {
          "id": "differential_expression",
          "name": "Run DESeq2 differential expression",
          "outputs": [
            "results/deseq2/all.rds",
            "results/deseq2/normcounts.symbol.tsv",
            "results/diffexp/treated-vs-untreated.diffexp.symbol.tsv",
            "results/diffexp/treated-vs-untreated.ma-plot.svg"
          ],
          "depends_on": [
            "count_matrix"
          ]
        },
        {
          "id": "pca_plot",
          "name": "Generate PCA plot",
          "outputs": [
            "results/pca.condition.svg"
          ],
          "depends_on": [
            "differential_expression"
          ]
        }
      ]
    }
  ]
}
