{
  "workflow_id": "epigen-enrichment_analysis-finish",
  "manifest_path": "finish/epigen-enrichment_analysis-finish/manifest.json",
  "version": "1",
  "updated_at": "2026-04-16",
  "notes": "Autogenerated contiguous partition. Edit pipeline_stage_label / inputs / outputs for paper-facing semantics.",
  "tasks": [
    {
      "task_id": "stage_01",
      "pipeline_stage_label": "Automated stage 1 (4 finish steps)",
      "order": 1,
      "step_ids": [
        "aggregate",
        "annot_export",
        "config_export",
        "env_export"
      ],
      "metadata": {
        "autogenerated": true,
        "summary": "Contiguous partition from finish manifest order; refine labels and IO as needed."
      },
      "inputs": [
        {
          "role": "workflow_entry",
          "description": "See finish manifest input_hints"
        }
      ],
      "outputs": [
        {
          "role": "checkpoint_last_step",
          "path_glob": "results/finish/env_export.done",
          "derived_from_step_ids": [
            "env_export"
          ]
        }
      ],
      "step_snapshots": [
        {
          "id": "aggregate",
          "name": "aggregate",
          "outputs": [
            "results/finish/aggregate.done"
          ],
          "depends_on": []
        },
        {
          "id": "annot_export",
          "name": "annot export",
          "outputs": [
            "results/finish/annot_export.done"
          ],
          "depends_on": [
            "aggregate"
          ]
        },
        {
          "id": "config_export",
          "name": "config export",
          "outputs": [
            "results/finish/config_export.done"
          ],
          "depends_on": [
            "annot_export"
          ]
        },
        {
          "id": "env_export",
          "name": "env export",
          "outputs": [
            "results/finish/env_export.done"
          ],
          "depends_on": [
            "config_export"
          ]
        }
      ]
    },
    {
      "task_id": "stage_02",
      "pipeline_stage_label": "Automated stage 2 (4 finish steps)",
      "order": 2,
      "step_ids": [
        "gene_ORA_GSEApy",
        "gene_motif_enrichment_analysis_RcisTarget",
        "gene_preranked_GSEApy",
        "plot_enrichment_result"
      ],
      "metadata": {
        "autogenerated": true,
        "summary": "Contiguous partition from finish manifest order; refine labels and IO as needed."
      },
      "inputs": [
        {
          "role": "upstream",
          "derived_from_step_ids": [
            "gene_ORA_GSEApy"
          ]
        }
      ],
      "outputs": [
        {
          "role": "checkpoint_last_step",
          "path_glob": "results/finish/plot_enrichment_result.done",
          "derived_from_step_ids": [
            "plot_enrichment_result"
          ]
        }
      ],
      "step_snapshots": [
        {
          "id": "gene_ORA_GSEApy",
          "name": "gene ORA GSEApy",
          "outputs": [
            "results/finish/gene_ORA_GSEApy.done"
          ],
          "depends_on": [
            "env_export"
          ]
        },
        {
          "id": "gene_motif_enrichment_analysis_RcisTarget",
          "name": "gene motif enrichment analysis RcisTarget",
          "outputs": [
            "results/finish/gene_motif_enrichment_analysis_RcisTarget.done"
          ],
          "depends_on": [
            "gene_ORA_GSEApy"
          ]
        },
        {
          "id": "gene_preranked_GSEApy",
          "name": "gene preranked GSEApy",
          "outputs": [
            "results/finish/gene_preranked_GSEApy.done"
          ],
          "depends_on": [
            "gene_motif_enrichment_analysis_RcisTarget"
          ]
        },
        {
          "id": "plot_enrichment_result",
          "name": "plot enrichment result",
          "outputs": [
            "results/finish/plot_enrichment_result.done"
          ],
          "depends_on": [
            "gene_preranked_GSEApy"
          ]
        }
      ]
    },
    {
      "task_id": "stage_03",
      "pipeline_stage_label": "Automated stage 3 (4 finish steps)",
      "order": 3,
      "step_ids": [
        "prepare_databases",
        "process_results_pycisTarget",
        "region_enrichment_analysis_GREAT",
        "region_enrichment_analysis_LOLA"
      ],
      "metadata": {
        "autogenerated": true,
        "summary": "Contiguous partition from finish manifest order; refine labels and IO as needed."
      },
      "inputs": [
        {
          "role": "upstream",
          "derived_from_step_ids": [
            "prepare_databases"
          ]
        }
      ],
      "outputs": [
        {
          "role": "checkpoint_last_step",
          "path_glob": "results/finish/region_enrichment_analysis_LOLA.done",
          "derived_from_step_ids": [
            "region_enrichment_analysis_LOLA"
          ]
        }
      ],
      "step_snapshots": [
        {
          "id": "prepare_databases",
          "name": "prepare databases",
          "outputs": [
            "results/finish/prepare_databases.done"
          ],
          "depends_on": [
            "plot_enrichment_result"
          ]
        },
        {
          "id": "process_results_pycisTarget",
          "name": "process results pycisTarget",
          "outputs": [
            "results/finish/process_results_pycisTarget.done"
          ],
          "depends_on": [
            "prepare_databases"
          ]
        },
        {
          "id": "region_enrichment_analysis_GREAT",
          "name": "region enrichment analysis GREAT",
          "outputs": [
            "results/finish/region_enrichment_analysis_GREAT.done"
          ],
          "depends_on": [
            "process_results_pycisTarget"
          ]
        },
        {
          "id": "region_enrichment_analysis_LOLA",
          "name": "region enrichment analysis LOLA",
          "outputs": [
            "results/finish/region_enrichment_analysis_LOLA.done"
          ],
          "depends_on": [
            "region_enrichment_analysis_GREAT"
          ]
        }
      ]
    },
    {
      "task_id": "stage_04",
      "pipeline_stage_label": "Automated stage 4 (4 finish steps)",
      "order": 4,
      "step_ids": [
        "region_gene_association_GREAT",
        "region_motif_enrichment_analysis_pycisTarget",
        "visualize",
        "all"
      ],
      "metadata": {
        "autogenerated": true,
        "summary": "Contiguous partition from finish manifest order; refine labels and IO as needed."
      },
      "inputs": [
        {
          "role": "upstream",
          "derived_from_step_ids": [
            "region_gene_association_GREAT"
          ]
        }
      ],
      "outputs": [
        {
          "role": "checkpoint_last_step",
          "path_glob": "results/finish/all.done",
          "derived_from_step_ids": [
            "all"
          ]
        }
      ],
      "step_snapshots": [
        {
          "id": "region_gene_association_GREAT",
          "name": "region gene association GREAT",
          "outputs": [
            "results/finish/region_gene_association_GREAT.done"
          ],
          "depends_on": [
            "region_enrichment_analysis_LOLA"
          ]
        },
        {
          "id": "region_motif_enrichment_analysis_pycisTarget",
          "name": "region motif enrichment analysis pycisTarget",
          "outputs": [
            "results/finish/region_motif_enrichment_analysis_pycisTarget.done"
          ],
          "depends_on": [
            "region_gene_association_GREAT"
          ]
        },
        {
          "id": "visualize",
          "name": "visualize",
          "outputs": [
            "results/finish/visualize.done"
          ],
          "depends_on": [
            "region_motif_enrichment_analysis_pycisTarget"
          ]
        },
        {
          "id": "all",
          "name": "all",
          "outputs": [
            "results/finish/all.done"
          ],
          "depends_on": [
            "visualize"
          ]
        }
      ]
    }
  ]
}
