{
  "workflow_id": "tgirke-systempiperdata-rnaseq-finish",
  "manifest_path": "finish/tgirke-systempiperdata-rnaseq-finish/manifest.json",
  "version": "1",
  "updated_at": "2026-04-16",
  "notes": "Autogenerated contiguous partition. Edit pipeline_stage_label / inputs / outputs for paper-facing semantics.",
  "tasks": [
    {
      "task_id": "stage_01",
      "pipeline_stage_label": "Automated stage 1 (4 finish steps)",
      "order": 1,
      "step_ids": [
        "load_SPR",
        "preprocessing",
        "custom_preprocessing_function",
        "trimming"
      ],
      "metadata": {
        "autogenerated": true,
        "summary": "Contiguous partition from finish manifest order; refine labels and IO as needed."
      },
      "inputs": [
        {
          "role": "workflow_entry",
          "description": "See finish manifest input_hints"
        }
      ],
      "outputs": [
        {
          "role": "checkpoint_last_step",
          "path_glob": "results/finish/trimming.done",
          "derived_from_step_ids": [
            "trimming"
          ]
        }
      ],
      "step_snapshots": [
        {
          "id": "load_SPR",
          "name": "load SPR",
          "outputs": [
            "results/finish/load_SPR.done"
          ],
          "depends_on": []
        },
        {
          "id": "preprocessing",
          "name": "preprocessing",
          "outputs": [
            "results/finish/preprocessing.done"
          ],
          "depends_on": [
            "load_SPR"
          ]
        },
        {
          "id": "custom_preprocessing_function",
          "name": "custom preprocessing function",
          "outputs": [
            "results/finish/custom_preprocessing_function.done"
          ],
          "depends_on": [
            "preprocessing"
          ]
        },
        {
          "id": "trimming",
          "name": "trimming",
          "outputs": [
            "results/finish/trimming.done"
          ],
          "depends_on": [
            "custom_preprocessing_function"
          ]
        }
      ]
    },
    {
      "task_id": "stage_02",
      "pipeline_stage_label": "Automated stage 2 (4 finish steps)",
      "order": 2,
      "step_ids": [
        "fastq_report",
        "hisat2_index",
        "hisat2_mapping",
        "align_stats"
      ],
      "metadata": {
        "autogenerated": true,
        "summary": "Contiguous partition from finish manifest order; refine labels and IO as needed."
      },
      "inputs": [
        {
          "role": "upstream",
          "derived_from_step_ids": [
            "fastq_report"
          ]
        }
      ],
      "outputs": [
        {
          "role": "checkpoint_last_step",
          "path_glob": "results/finish/align_stats.done",
          "derived_from_step_ids": [
            "align_stats"
          ]
        }
      ],
      "step_snapshots": [
        {
          "id": "fastq_report",
          "name": "fastq report",
          "outputs": [
            "results/finish/fastq_report.done"
          ],
          "depends_on": [
            "trimming"
          ]
        },
        {
          "id": "hisat2_index",
          "name": "hisat2 index",
          "outputs": [
            "results/finish/hisat2_index.done"
          ],
          "depends_on": [
            "fastq_report"
          ]
        },
        {
          "id": "hisat2_mapping",
          "name": "hisat2 mapping",
          "outputs": [
            "results/finish/hisat2_mapping.done"
          ],
          "depends_on": [
            "hisat2_index"
          ]
        },
        {
          "id": "align_stats",
          "name": "align stats",
          "outputs": [
            "results/finish/align_stats.done"
          ],
          "depends_on": [
            "hisat2_mapping"
          ]
        }
      ]
    },
    {
      "task_id": "stage_03",
      "pipeline_stage_label": "Automated stage 3 (4 finish steps)",
      "order": 3,
      "step_ids": [
        "bam_IGV",
        "create_db",
        "read_counting",
        "sample_tree"
      ],
      "metadata": {
        "autogenerated": true,
        "summary": "Contiguous partition from finish manifest order; refine labels and IO as needed."
      },
      "inputs": [
        {
          "role": "upstream",
          "derived_from_step_ids": [
            "bam_IGV"
          ]
        }
      ],
      "outputs": [
        {
          "role": "checkpoint_last_step",
          "path_glob": "results/finish/sample_tree.done",
          "derived_from_step_ids": [
            "sample_tree"
          ]
        }
      ],
      "step_snapshots": [
        {
          "id": "bam_IGV",
          "name": "bam IGV",
          "outputs": [
            "results/finish/bam_IGV.done"
          ],
          "depends_on": [
            "align_stats"
          ]
        },
        {
          "id": "create_db",
          "name": "create db",
          "outputs": [
            "results/finish/create_db.done"
          ],
          "depends_on": [
            "bam_IGV"
          ]
        },
        {
          "id": "read_counting",
          "name": "read counting",
          "outputs": [
            "results/finish/read_counting.done"
          ],
          "depends_on": [
            "create_db"
          ]
        },
        {
          "id": "sample_tree",
          "name": "sample tree",
          "outputs": [
            "results/finish/sample_tree.done"
          ],
          "depends_on": [
            "read_counting"
          ]
        }
      ]
    },
    {
      "task_id": "stage_04",
      "pipeline_stage_label": "Automated stage 4 (3 finish steps)",
      "order": 4,
      "step_ids": [
        "run_edger",
        "custom_annot",
        "filter_degs"
      ],
      "metadata": {
        "autogenerated": true,
        "summary": "Contiguous partition from finish manifest order; refine labels and IO as needed."
      },
      "inputs": [
        {
          "role": "upstream",
          "derived_from_step_ids": [
            "run_edger"
          ]
        }
      ],
      "outputs": [
        {
          "role": "checkpoint_last_step",
          "path_glob": "results/finish/filter_degs.done",
          "derived_from_step_ids": [
            "filter_degs"
          ]
        }
      ],
      "step_snapshots": [
        {
          "id": "run_edger",
          "name": "run edger",
          "outputs": [
            "results/finish/run_edger.done"
          ],
          "depends_on": [
            "sample_tree"
          ]
        },
        {
          "id": "custom_annot",
          "name": "custom annot",
          "outputs": [
            "results/finish/custom_annot.done"
          ],
          "depends_on": [
            "run_edger"
          ]
        },
        {
          "id": "filter_degs",
          "name": "filter degs",
          "outputs": [
            "results/finish/filter_degs.done"
          ],
          "depends_on": [
            "custom_annot"
          ]
        }
      ]
    },
    {
      "task_id": "stage_05",
      "pipeline_stage_label": "Automated stage 5 (3 finish steps)",
      "order": 5,
      "step_ids": [
        "venn_diagram",
        "get_go_annot",
        "go_enrich"
      ],
      "metadata": {
        "autogenerated": true,
        "summary": "Contiguous partition from finish manifest order; refine labels and IO as needed."
      },
      "inputs": [
        {
          "role": "upstream",
          "derived_from_step_ids": [
            "venn_diagram"
          ]
        }
      ],
      "outputs": [
        {
          "role": "checkpoint_last_step",
          "path_glob": "results/finish/go_enrich.done",
          "derived_from_step_ids": [
            "go_enrich"
          ]
        }
      ],
      "step_snapshots": [
        {
          "id": "venn_diagram",
          "name": "venn diagram",
          "outputs": [
            "results/finish/venn_diagram.done"
          ],
          "depends_on": [
            "filter_degs"
          ]
        },
        {
          "id": "get_go_annot",
          "name": "get go annot",
          "outputs": [
            "results/finish/get_go_annot.done"
          ],
          "depends_on": [
            "venn_diagram"
          ]
        },
        {
          "id": "go_enrich",
          "name": "go enrich",
          "outputs": [
            "results/finish/go_enrich.done"
          ],
          "depends_on": [
            "get_go_annot"
          ]
        }
      ]
    },
    {
      "task_id": "stage_06",
      "pipeline_stage_label": "Automated stage 6 (3 finish steps)",
      "order": 6,
      "step_ids": [
        "go_plot",
        "heatmap",
        "sessionInfo"
      ],
      "metadata": {
        "autogenerated": true,
        "summary": "Contiguous partition from finish manifest order; refine labels and IO as needed."
      },
      "inputs": [
        {
          "role": "upstream",
          "derived_from_step_ids": [
            "go_plot"
          ]
        }
      ],
      "outputs": [
        {
          "role": "checkpoint_last_step",
          "path_glob": "results/finish/sessionInfo.done",
          "derived_from_step_ids": [
            "sessionInfo"
          ]
        }
      ],
      "step_snapshots": [
        {
          "id": "go_plot",
          "name": "go plot",
          "outputs": [
            "results/finish/go_plot.done"
          ],
          "depends_on": [
            "go_enrich"
          ]
        },
        {
          "id": "heatmap",
          "name": "heatmap",
          "outputs": [
            "results/finish/heatmap.done"
          ],
          "depends_on": [
            "go_plot"
          ]
        },
        {
          "id": "sessionInfo",
          "name": "sessionInfo",
          "outputs": [
            "results/finish/sessionInfo.done"
          ],
          "depends_on": [
            "heatmap"
          ]
        }
      ]
    }
  ]
}
